{
  "$schema": "https://json-schema.org/draft/2020-12/schema",
  "$id": "https://github.com/datopsis/nginx-ubi/artifacts/artifact-lock.schema.json",
  "title": "nginx-ubi artifact lock",
  "type": "object",
  "additionalProperties": false,
  "required": [
    "schema_version",
    "bundle_version",
    "architecture",
    "rpm_architecture",
    "generated_at",
    "nginx_version",
    "nginx_rpm_version",
    "base_images",
    "signing_keys",
    "packages",
    "source_packages"
  ],
  "properties": {
    "schema_version": { "const": 1 },
    "bundle_version": { "const": 1 },
    "architecture": { "enum": ["amd64", "arm64"] },
    "rpm_architecture": { "enum": ["x86_64", "aarch64"] },
    "generated_at": { "type": "string", "format": "date-time" },
    "nginx_version": { "type": "string", "pattern": "^[0-9]+\\.[0-9]+\\.[0-9]+$" },
    "nginx_rpm_version": { "type": "string", "minLength": 1 },
    "base_images": {
      "type": "object",
      "additionalProperties": false,
      "required": ["builder", "runtime"],
      "properties": {
        "builder": { "$ref": "#/$defs/baseImage" },
        "runtime": { "$ref": "#/$defs/baseImage" }
      }
    },
    "signing_keys": {
      "type": "array",
      "minItems": 1,
      "items": { "$ref": "#/$defs/key" }
    },
    "packages": {
      "type": "array",
      "minItems": 1,
      "items": { "$ref": "#/$defs/package" }
    },
    "source_packages": {
      "type": "array",
      "minItems": 1,
      "items": { "$ref": "#/$defs/sourcePackage" }
    }
  },
  "$defs": {
    "sha256": { "type": "string", "pattern": "^[a-f0-9]{64}$" },
    "baseImage": {
      "type": "object",
      "additionalProperties": false,
      "required": ["reference", "digest", "platform"],
      "properties": {
        "reference": { "type": "string", "minLength": 1 },
        "digest": { "type": "string", "pattern": "^sha256:[a-f0-9]{64}$" },
        "platform": { "type": "string", "pattern": "^linux/(amd64|arm64)$" }
      }
    },
    "key": {
      "type": "object",
      "additionalProperties": false,
      "required": ["id", "filename", "url", "sha256", "fingerprint"],
      "properties": {
        "id": { "type": "string", "pattern": "^[a-z0-9-]+$" },
        "filename": { "type": "string", "pattern": "^[A-Za-z0-9._-]+$" },
        "url": { "type": "string", "pattern": "^https://" },
        "sha256": { "$ref": "#/$defs/sha256" },
        "fingerprint": { "type": "string", "pattern": "^[A-F0-9]{40}$" }
      }
    },
    "package": {
      "type": "object",
      "additionalProperties": false,
      "required": ["name", "epoch", "version", "release", "architecture", "nevra", "filename", "url", "repository", "size", "sha256", "signing_key_fingerprint", "source_rpm"],
      "properties": {
        "name": { "type": "string", "minLength": 1 },
        "epoch": { "type": "integer", "minimum": 0 },
        "version": { "type": "string", "minLength": 1 },
        "release": { "type": "string", "minLength": 1 },
        "architecture": { "type": "string", "minLength": 1 },
        "nevra": { "type": "string", "minLength": 1 },
        "filename": { "type": "string", "pattern": "^[A-Za-z0-9+_.-]+\\.rpm$" },
        "url": { "type": "string", "pattern": "^https://" },
        "repository": { "type": "string", "minLength": 1 },
        "size": { "type": "integer", "minimum": 1 },
        "sha256": { "$ref": "#/$defs/sha256" },
        "signing_key_fingerprint": { "type": "string", "pattern": "^[A-F0-9]{40}$" },
        "source_rpm": { "type": "string", "pattern": "^[A-Za-z0-9+_.-]+\\.src\\.rpm$" }
      }
    },
    "sourcePackage": {
      "type": "object",
      "additionalProperties": false,
      "required": ["filename", "url", "repository", "size", "sha256"],
      "properties": {
        "filename": { "type": "string", "pattern": "^[A-Za-z0-9+_.-]+\\.src\\.rpm$" },
        "url": { "type": "string", "pattern": "^https://" },
        "repository": { "type": "string", "minLength": 1 },
        "size": { "type": "integer", "minimum": 1 },
        "sha256": { "$ref": "#/$defs/sha256" }
      }
    }
  }
}
