{
  "schema_version": 1,
  "bundle_version": 1,
  "architecture": "arm64",
  "rpm_architecture": "aarch64",
  "generated_at": "2026-09-12T15:53:03Z",
  "nginx_version": "1.30.4",
  "nginx_rpm_version": "1.30.4-1.el9.ngx",
  "base_images": {
    "builder": {
      "reference": "registry.access.redhat.com/ubi9/ubi-minimal:9.8@sha256:7fbeae18dc9476399f565e68255f602a3374ea8614ba3d14843565131a13ff93",
      "digest": "sha256:7fbeae18dc9476399f565e68255f602a3374ea8614ba3d14843565131a13ff93",
      "platform": "linux/arm64"
    },
    "runtime": {
      "reference": "registry.access.redhat.com/ubi9/ubi-micro:9.8@sha256:f332c99eb8f798a8486821c91937f10ad64ee83d7e739303be2df051040918f6",
      "digest": "sha256:f332c99eb8f798a8486821c91937f10ad64ee83d7e739303be2df051040918f6",
      "platform": "linux/arm64"
    }
  },
  "signing_keys": [
    {
      "fingerprint": "8540A6F18833A80E9C1653A42FD21310B49F6B46",
      "id": "nginx-signing",
      "sha256": "55385da31d198fa6a5012d40ae98ecb272a6c4e8fffffba94719ffd3e87de37a",
      "url": "https://nginx.org/keys/nginx_signing.key",
      "filename": "nginx_signing.key"
    },
    {
      "fingerprint": "567E347AD0044ADE55BA8A5F199E2F91FD431D51",
      "id": "redhat-release",
      "sha256": "d4b2543626bee31d9438d4a31731aae712c072893c7aed8854f16c42fafc742b",
      "url": "https://security.access.redhat.com/data/fd431d51.txt",
      "filename": "fd431d51.txt"
    },
    {
      "fingerprint": "7E4624258C406535D56D6F135054E4A45A6340B3",
      "id": "redhat-release-2",
      "sha256": "d37ed8bd8bddb29983a38c6fde4e59d329e6a7c2ecbc702e929f0d05ae5eba59",
      "url": "https://security.access.redhat.com/data/5a6340b3.txt",
      "filename": "5a6340b3.txt"
    }
  ],
  "packages": [
    {
      "name": "acl",
      "epoch": 0,
      "version": "2.4.0",
      "release": "1.el9_8",
      "architecture": "aarch64",
      "nevra": "acl-0:2.4.0-1.el9_8.aarch64",
      "filename": "acl-2.4.0-1.el9_8.aarch64.rpm",
      "url": "https://cdn-ubi.redhat.com/content/public/ubi/dist/ubi9/9/aarch64/baseos/os/Packages/a/acl-2.4.0-1.el9_8.aarch64.rpm",
      "repository": "ubi-9-baseos-rpms",
      "size": 84537,
      "sha256": "241864fdb68d73b5a63df6269ae0895aec7c08e723fb0506fe446c148c9dad3f",
      "signing_key_fingerprint": "567E347AD0044ADE55BA8A5F199E2F91FD431D51",
      "source_rpm": "acl-2.4.0-1.el9_8.src.rpm"
    },
    {
      "name": "alternatives",
      "epoch": 0,
      "version": "1.24",
      "release": "2.el9",
      "architecture": "aarch64",
      "nevra": "alternatives-0:1.24-2.el9.aarch64",
      "filename": "alternatives-1.24-2.el9.aarch64.rpm",
      "url": "https://cdn-ubi.redhat.com/content/public/ubi/dist/ubi9/9/aarch64/baseos/os/Packages/a/alternatives-1.24-2.el9.aarch64.rpm",
      "repository": "ubi-9-baseos-rpms",
      "size": 42137,
      "sha256": "6f7c0667ac015bc0d40836c9f55c73ebf65a209069f69aa8f58e6b4655c820a8",
      "signing_key_fingerprint": "567E347AD0044ADE55BA8A5F199E2F91FD431D51",
      "source_rpm": "chkconfig-1.24-2.el9.src.rpm"
    },
    {
      "name": "audit-libs",
      "epoch": 0,
      "version": "3.1.5",
      "release": "8.el9",
      "architecture": "aarch64",
      "nevra": "audit-libs-0:3.1.5-8.el9.aarch64",
      "filename": "audit-libs-3.1.5-8.el9.aarch64.rpm",
      "url": "https://cdn-ubi.redhat.com/content/public/ubi/dist/ubi9/9/aarch64/baseos/os/Packages/a/audit-libs-3.1.5-8.el9.aarch64.rpm",
      "repository": "ubi-9-baseos-rpms",
      "size": 128901,
      "sha256": "11880ec70b575841843cbee0853e03e50a0506321ea0a6f76c0c8145d79ae531",
      "signing_key_fingerprint": "567E347AD0044ADE55BA8A5F199E2F91FD431D51",
      "source_rpm": "audit-3.1.5-8.el9.src.rpm"
    },
    {
      "name": "basesystem",
      "epoch": 0,
      "version": "11",
      "release": "13.el9",
      "architecture": "noarch",
      "nevra": "basesystem-0:11-13.el9.noarch",
      "filename": "basesystem-11-13.el9.noarch.rpm",
      "url": "https://cdn-ubi.redhat.com/content/public/ubi/dist/ubi9/9/aarch64/baseos/os/Packages/b/basesystem-11-13.el9.noarch.rpm",
      "repository": "ubi-9-baseos-rpms",
      "size": 8229,
      "sha256": "f498b0813fa1a825d550e8e3a9e42255eabfa18e6fc96adfc6cc8fa7e16dd513",
      "signing_key_fingerprint": "567E347AD0044ADE55BA8A5F199E2F91FD431D51",
      "source_rpm": "basesystem-11-13.el9.src.rpm"
    },
    {
      "name": "bash",
      "epoch": 0,
      "version": "5.1.8",
      "release": "9.el9",
      "architecture": "aarch64",
      "nevra": "bash-0:5.1.8-9.el9.aarch64",
      "filename": "bash-5.1.8-9.el9.aarch64.rpm",
      "url": "https://cdn-ubi.redhat.com/content/public/ubi/dist/ubi9/9/aarch64/baseos/os/Packages/b/bash-5.1.8-9.el9.aarch64.rpm",
      "repository": "ubi-9-baseos-rpms",
      "size": 1760045,
      "sha256": "7dc1febec9c2fb184ed4407f8a188ab267b7e46b3534866f702c6266008ababa",
      "signing_key_fingerprint": "567E347AD0044ADE55BA8A5F199E2F91FD431D51",
      "source_rpm": "bash-5.1.8-9.el9.src.rpm"
    },
    {
      "name": "bzip2-libs",
      "epoch": 0,
      "version": "1.0.8",
      "release": "11.el9",
      "architecture": "aarch64",
      "nevra": "bzip2-libs-0:1.0.8-11.el9.aarch64",
      "filename": "bzip2-libs-1.0.8-11.el9.aarch64.rpm",
      "url": "https://cdn-ubi.redhat.com/content/public/ubi/dist/ubi9/9/aarch64/baseos/os/Packages/b/bzip2-libs-1.0.8-11.el9.aarch64.rpm",
      "repository": "ubi-9-baseos-rpms",
      "size": 47655,
      "sha256": "8267a866b9289ac4e4a92cb4642adcdeff97c2ed816ddda87ed5d5e9d9431a2f",
      "signing_key_fingerprint": "567E347AD0044ADE55BA8A5F199E2F91FD431D51",
      "source_rpm": "bzip2-1.0.8-11.el9.src.rpm"
    },
    {
      "name": "ca-certificates",
      "epoch": 0,
      "version": "2025.2.80_v9.0.305",
      "release": "91.el9",
      "architecture": "noarch",
      "nevra": "ca-certificates-0:2025.2.80_v9.0.305-91.el9.noarch",
      "filename": "ca-certificates-2025.2.80_v9.0.305-91.el9.noarch.rpm",
      "url": "https://cdn-ubi.redhat.com/content/public/ubi/dist/ubi9/9/aarch64/baseos/os/Packages/c/ca-certificates-2025.2.80_v9.0.305-91.el9.noarch.rpm",
      "repository": "ubi-9-baseos-rpms",
      "size": 1072208,
      "sha256": "0554bf65d573950e7d550a07bf7d0b3def85ca3b45a7fbde4cce7cadd9a476a7",
      "signing_key_fingerprint": "567E347AD0044ADE55BA8A5F199E2F91FD431D51",
      "source_rpm": "ca-certificates-2025.2.80_v9.0.305-91.el9.src.rpm"
    },
    {
      "name": "coreutils",
      "epoch": 0,
      "version": "8.32",
      "release": "41.el9_8.1",
      "architecture": "aarch64",
      "nevra": "coreutils-0:8.32-41.el9_8.1.aarch64",
      "filename": "coreutils-8.32-41.el9_8.1.aarch64.rpm",
      "url": "https://cdn-ubi.redhat.com/content/public/ubi/dist/ubi9/9/aarch64/baseos/os/Packages/c/coreutils-8.32-41.el9_8.1.aarch64.rpm",
      "repository": "ubi-9-baseos-rpms",
      "size": 1175876,
      "sha256": "22827aedd764c1ab706086965859e7f8fef0d719ac0b3d8735f6b8e53b0a13e9",
      "signing_key_fingerprint": "567E347AD0044ADE55BA8A5F199E2F91FD431D51",
      "source_rpm": "coreutils-8.32-41.el9_8.1.src.rpm"
    },
    {
      "name": "coreutils-common",
      "epoch": 0,
      "version": "8.32",
      "release": "41.el9_8.1",
      "architecture": "aarch64",
      "nevra": "coreutils-common-0:8.32-41.el9_8.1.aarch64",
      "filename": "coreutils-common-8.32-41.el9_8.1.aarch64.rpm",
      "url": "https://cdn-ubi.redhat.com/content/public/ubi/dist/ubi9/9/aarch64/baseos/os/Packages/c/coreutils-common-8.32-41.el9_8.1.aarch64.rpm",
      "repository": "ubi-9-baseos-rpms",
      "size": 2115646,
      "sha256": "b449955249a6d2da7369522a5ac2759919d36633e129ba88924057814906d5f5",
      "signing_key_fingerprint": "567E347AD0044ADE55BA8A5F199E2F91FD431D51",
      "source_rpm": "coreutils-8.32-41.el9_8.1.src.rpm"
    },
    {
      "name": "cracklib",
      "epoch": 0,
      "version": "2.9.6",
      "release": "28.el9",
      "architecture": "aarch64",
      "nevra": "cracklib-0:2.9.6-28.el9.aarch64",
      "filename": "cracklib-2.9.6-28.el9.aarch64.rpm",
      "url": "https://cdn-ubi.redhat.com/content/public/ubi/dist/ubi9/9/aarch64/baseos/os/Packages/c/cracklib-2.9.6-28.el9.aarch64.rpm",
      "repository": "ubi-9-baseos-rpms",
      "size": 102026,
      "sha256": "d85216b672a15e5dd8cc771b853e3b73e832034949ee23998d8403609fba00a2",
      "signing_key_fingerprint": "567E347AD0044ADE55BA8A5F199E2F91FD431D51",
      "source_rpm": "cracklib-2.9.6-28.el9.src.rpm"
    },
    {
      "name": "cracklib-dicts",
      "epoch": 0,
      "version": "2.9.6",
      "release": "28.el9",
      "architecture": "aarch64",
      "nevra": "cracklib-dicts-0:2.9.6-28.el9.aarch64",
      "filename": "cracklib-dicts-2.9.6-28.el9.aarch64.rpm",
      "url": "https://cdn-ubi.redhat.com/content/public/ubi/dist/ubi9/9/aarch64/baseos/os/Packages/c/cracklib-dicts-2.9.6-28.el9.aarch64.rpm",
      "repository": "ubi-9-baseos-rpms",
      "size": 3829400,
      "sha256": "807345f95c448cb58d4db8d059f76e4c139ef029887d59b431efd20db934745a",
      "signing_key_fingerprint": "567E347AD0044ADE55BA8A5F199E2F91FD431D51",
      "source_rpm": "cracklib-2.9.6-28.el9.src.rpm"
    },
    {
      "name": "crypto-policies",
      "epoch": 0,
      "version": "20260224",
      "release": "1.gitea0f072.el9_8",
      "architecture": "noarch",
      "nevra": "crypto-policies-0:20260224-1.gitea0f072.el9_8.noarch",
      "filename": "crypto-policies-20260224-1.gitea0f072.el9_8.noarch.rpm",
      "url": "https://cdn-ubi.redhat.com/content/public/ubi/dist/ubi9/9/aarch64/baseos/os/Packages/c/crypto-policies-20260224-1.gitea0f072.el9_8.noarch.rpm",
      "repository": "ubi-9-baseos-rpms",
      "size": 98707,
      "sha256": "a9ad86b8df75a7c9c29c6f6dd4b8f78cfa1f42b492eff0d11b82c457d37a7f9f",
      "signing_key_fingerprint": "567E347AD0044ADE55BA8A5F199E2F91FD431D51",
      "source_rpm": "crypto-policies-20260224-1.gitea0f072.el9_8.src.rpm"
    },
    {
      "name": "dbus",
      "epoch": 1,
      "version": "1.12.20",